{
  "schema_version": "tracking-annotation-v1",
  "video_id": "demo-perfect",
  "fps": 5,
  "frames": [
    {
      "frame_index": 0,
      "time_sec": 0.0,
      "objects": [
        {
          "identity": "player-8",
          "ignore": false,
          "bbox": {"x": 0.1, "y": 0.2, "w": 0.1, "h": 0.2}
        }
      ]
    },
    {
      "frame_index": 1,
      "time_sec": 0.2,
      "objects": [
        {
          "identity": "player-8",
          "ignore": false,
          "bbox": {"x": 0.11, "y": 0.2, "w": 0.1, "h": 0.2}
        }
      ]
    },
    {
      "frame_index": 2,
      "time_sec": 0.4,
      "objects": [
        {
          "identity": "player-8",
          "ignore": false,
          "bbox": {"x": 0.12, "y": 0.2, "w": 0.1, "h": 0.2}
        }
      ]
    },
    {
      "frame_index": 3,
      "time_sec": 0.6,
      "objects": [
        {
          "identity": "player-8",
          "ignore": false,
          "bbox": {"x": 0.13, "y": 0.2, "w": 0.1, "h": 0.2}
        }
      ]
    },
    {
      "frame_index": 4,
      "time_sec": 0.8,
      "objects": [
        {
          "identity": "player-8",
          "ignore": false,
          "bbox": {"x": 0.14, "y": 0.2, "w": 0.1, "h": 0.2}
        }
      ]
    }
  ]
}
